{
  "$schema": "https://json-schema.org/draft/2020-12/schema",
  "$id": "https://github.com/autowarefoundation/auto_e2e/Tools/visual-ml-model/schema/arch_v1.schema.json",
  "title": "VisualMLModel Architecture-Diagram IR v1.0",
  "description": "A GENERAL left-to-right node+edge graph that mimics a hand-drawn paper/README architecture figure: inputs on the LEFT, outputs/losses on the RIGHT, with branching, merging, dashed loss/auxiliary edges, and grouping banners (e.g. 'ONLY DURING TRAINING'). Unlike flow_v1 (an ordered LINEAR spine), this is an explicit directed graph laid out automatically into left-to-right layers. Rendered as a deterministic dependency-free inline SVG. NOTE: nodes/edges/groups are TOP-LEVEL (no 'graph' key) so this never collides with the ir_v1 structural validator.",
  "type": "object",
  "required": ["arch_version", "model_name", "nodes", "edges"],
  "additionalProperties": false,
  "properties": {
    "arch_version": { "const": "1.0" },
    "model_name": { "type": "string" },
    "arch_family": { "type": "string", "description": "one-line family, e.g. 'multi-camera -> view fusion -> trajectory planner + future-state aux'" },
    "config_assumptions": { "type": "object", "description": "concrete config used (num_views, embed_dim, mode, ...)" },
    "notes": { "type": "string" },
    "global_confidence": { "type": "number", "minimum": 0, "maximum": 1 },
    "nodes": {
      "type": "array",
      "description": "every box in the figure. Order does NOT imply flow; flow is given by edges. Layout (left->right columns) is computed from edges + optional lane/row hints.",
      "items": {
        "type": "object",
        "required": ["id", "title", "role"],
        "additionalProperties": false,
        "properties": {
          "id": { "type": "string", "description": "unique; referenced by edges and group members" },
          "title": { "type": "string", "description": "short bold box title, e.g. 'Driving Policy', 'Concat inputs'" },
          "desc": { "type": "string", "description": "1-2 line plain-language description shown inside the box; WRAPPED by the renderer" },
          "shape": {
            "type": ["string", "array", "null"],
            "items": { "type": ["string", "integer"] },
            "description": "ONE tensor shape shown in the box, free-form paren string PREFERRED, e.g. '(8,96,56,56)' or '(2328)'. null for loss/abstract nodes. (Array form tolerated and normalized to paren style by the renderer.)"
          },
          "role": {
            "description": "drives box color. The FIRST group are shared ontology/flow roles; the LAST 5 are new figure-level roles for arch mode.",
            "enum": ["input", "output", "backbone", "embedding", "convolution",
                     "self_attention", "cross_attention", "conditioning", "linear_proj",
                     "ffn_mlp_block", "moe_block", "normalization", "activation",
                     "positional_encoding", "recurrent", "pooler", "fusion", "head",
                     "merge_add", "buffer", "other",
                     "policy", "future_state", "prediction", "learning_method", "loss"]
          },
          "train_only": { "type": "boolean", "description": "true if this node exists ONLY during training (aux/self-supervision/loss path). Drives the 'ONLY DURING TRAINING' banner + a dimmed/dashed box. Default false." },
          "lane": { "type": ["integer", "null"], "minimum": 0, "description": "OPTIONAL column hint, 0=leftmost (inputs). Omit/null to let the layout compute it (longest-path over dataflow edges). Fill for ALL nodes or NONE." },
          "row": { "type": ["integer", "null"], "description": "OPTIONAL vertical-order hint WITHIN a lane (smaller = higher). Omit/null to auto-order." },
          "group": { "type": ["string", "null"], "description": "id of a groups[] entry this node belongs to (banner membership), or null" },
          "detail": { "type": "string", "description": "optional extra sentences shown on click (reuses the #tip mechanism)" },
          "confidence": { "type": "number", "minimum": 0, "maximum": 1 },
          "params": { "type": ["string", "integer", "null"], "description": "approx param count, e.g. '~28M'" }
        }
      }
    },
    "edges": {
      "type": "array",
      "description": "directed connections. SOLID = dataflow; DASHED is IMPLIED by kind. Unlike flow_v1, you MUST list the main dataflow edges (there is no implied spine).",
      "items": {
        "type": "object",
        "required": ["from", "to", "kind"],
        "additionalProperties": false,
        "properties": {
          "from": { "type": "string", "description": "source node id" },
          "to": { "type": "string", "description": "target node id" },
          "kind": {
            "description": "dataflow=solid gray forward tensor (used for layering); loss=dashed pink edge into a loss node incl. predicted-vs-true comparisons; feedback=dashed amber temporal/recurrent/conditioning/history loop (excluded from layering, bows back); skip=thin gold residual/shortcut (excluded from layering).",
            "enum": ["dataflow", "loss", "feedback", "skip"]
          },
          "label": { "type": ["string", "null"], "description": "optional edge label, e.g. 'fused 8x8 grid (K,V)', 'ego_hidden', 'Trajectory Loss'" }
        }
      }
    },
    "groups": {
      "type": "array",
      "description": "labeled banner bands spanning several nodes, e.g. 'ONLY DURING TRAINING'.",
      "items": {
        "type": "object",
        "required": ["id", "label"],
        "additionalProperties": false,
        "properties": {
          "id": { "type": "string" },
          "label": { "type": "string", "description": "banner text, e.g. 'ONLY DURING TRAINING'" },
          "members": { "type": "array", "items": { "type": "string" }, "description": "node ids covered; if omitted, the renderer uses all nodes with train_only=true" },
          "kind": { "enum": ["train_only_banner", "region"], "description": "default train_only_banner" }
        }
      }
    }
  }
}
